02:07:39.104273 IP (tos 0x0, ttl 64, id 7072, offset 0, flags [DF], proto UDP (17), length 60)
    localhost.38311 > localhost.38311: [bad udp cksum 0xfe3b -> 0x42a2!] UDP, length 32
02:07:39.116392 IP (tos 0x0, ttl 64, id 7073, offset 0, flags [DF], proto UDP (17), length 52)
    localhost.38311 > localhost.38311: [bad udp cksum 0xfe33 -> 0xfbc5!] UDP, length 24
02:07:39.117954 IP (tos 0x0, ttl 64, id 7074, offset 0, flags [DF], proto UDP (17), length 60)
    localhost.38311 > localhost.38311: [bad udp cksum 0xfe3b -> 0x777b!] UDP, length 32
02:07:39.128935 IP (tos 0x0, ttl 64, id 7075, offset 0, flags [DF], proto UDP (17), length 964)
    localhost.38311 > localhost.38311: [bad udp cksum 0x01c4 -> 0xce53!] UDP, length 936
02:07:39.128960 IP (tos 0x0, ttl 64, id 7076, offset 0, flags [DF], proto UDP (17), length 404)
    localhost.38311 > localhost.38311: [bad udp cksum 0xff93 -> 0xac3a!] UDP, length 376
02:07:39.128968 IP (tos 0x0, ttl 64, id 7077, offset 0, flags [DF], proto UDP (17), length 516)
    localhost.38311 > localhost.38311: [bad udp cksum 0x0004 -> 0x2aa0!] UDP, length 488
02:07:44.763246 IP (tos 0x0, ttl 64, id 4878, offset 0, flags [DF], proto TCP (6), length 60)
    localhost.37188 > localhost.8005: Flags [S], cksum 0xfe30 (incorrect -> 0xc0b2), seq 1129051590, win 65495, options [mss 65495,sackOK,TS val 956787884 ecr 0,nop,wscale 7], length 0
02:07:44.763269 IP (tos 0x0, ttl 64, id 0, offset 0, flags [DF], proto TCP (6), length 60)
    localhost.8005 > localhost.37188: Flags [S.], cksum 0xfe30 (incorrect -> 0xf917), seq 2860742494, ack 1129051591, win 65483, options [mss 65495,sackOK,TS val 956787884 ecr 956787884,nop,wscale 7], length 0
02:07:44.763286 IP (tos 0x0, ttl 64, id 4879, offset 0, flags [DF], proto TCP (6), length 52)
    localhost.37188 > localhost.8005: Flags [.], cksum 0xfe28 (incorrect -> 0x1fd4), seq 1, ack 1, win 512, options [nop,nop,TS val 956787884 ecr 956787884], length 0
02:07:51.605022 IP (tos 0x0, ttl 64, id 4880, offset 0, flags [DF], proto TCP (6), length 60)
    localhost.37188 > localhost.8005: Flags [P.], cksum 0xfe30 (incorrect -> 0x8ed0), seq 1:9, ack 1, win 512, options [nop,nop,TS val 956794726 ecr 956787884], length 8
02:07:51.605056 IP (tos 0x0, ttl 64, id 4109, offset 0, flags [DF], proto TCP (6), length 52)
    localhost.8005 > localhost.37188: Flags [.], cksum 0xfe28 (incorrect -> 0xea57), seq 1, ack 9, win 512, options [nop,nop,TS val 956794726 ecr 956794726], length 0
02:07:51.605143 IP (tos 0x0, ttl 64, id 4110, offset 0, flags [DF], proto TCP (6), length 56)
    localhost.8005 > localhost.37188: Flags [P.], cksum 0xfe2c (incorrect -> 0x0a77), seq 1:5, ack 9, win 512, options [nop,nop,TS val 956794726 ecr 956794726], length 4
02:07:51.605157 IP (tos 0x0, ttl 64, id 4881, offset 0, flags [DF], proto TCP (6), length 52)
    localhost.37188 > localhost.8005: Flags [.], cksum 0xfe28 (incorrect -> 0xea53), seq 9, ack 5, win 512, options [nop,nop,TS val 956794726 ecr 956794726], length 0
02:07:54.539784 IP (tos 0x0, ttl 64, id 4882, offset 0, flags [DF], proto TCP (6), length 60)
    localhost.37188 > localhost.8005: Flags [P.], cksum 0xfe30 (incorrect -> 0x6794), seq 9:17, ack 5, win 512, options [nop,nop,TS val 956797660 ecr 956794726], length 8
02:07:54.539898 IP (tos 0x0, ttl 64, id 4111, offset 0, flags [DF], proto TCP (6), length 56)
    localhost.8005 > localhost.37188: Flags [P.], cksum 0xfe2c (incorrect -> 0xf37d), seq 5:9, ack 17, win 512, options [nop,nop,TS val 956797661 ecr 956797660], length 4
02:07:54.539918 IP (tos 0x0, ttl 64, id 4883, offset 0, flags [DF], proto TCP (6), length 52)
    localhost.37188 > localhost.8005: Flags [.], cksum 0xfe28 (incorrect -> 0xd359), seq 17, ack 9, win 512, options [nop,nop,TS val 956797661 ecr 956797661], length 0
02:07:58.173651 IP (tos 0x0, ttl 64, id 4884, offset 0, flags [DF], proto TCP (6), length 60)
    localhost.37188 > localhost.8005: Flags [P.], cksum 0xfe30 (incorrect -> 0x4dda), seq 17:25, ack 9, win 512, options [nop,nop,TS val 956801294 ecr 956797661], length 8
02:07:58.173772 IP (tos 0x0, ttl 64, id 4112, offset 0, flags [DF], proto TCP (6), length 56)
    localhost.8005 > localhost.37188: Flags [P.], cksum 0xfe2c (incorrect -> 0xd70d), seq 9:13, ack 25, win 512, options [nop,nop,TS val 956801295 ecr 956801294], length 4
02:07:58.173791 IP (tos 0x0, ttl 64, id 4885, offset 0, flags [DF], proto TCP (6), length 52)
    localhost.37188 > localhost.8005: Flags [.], cksum 0xfe28 (incorrect -> 0xb6e9), seq 25, ack 13, win 512, options [nop,nop,TS val 956801295 ecr 956801295], length 0
02:07:59.107619 IP (tos 0x0, ttl 64, id 7078, offset 0, flags [DF], proto UDP (17), length 60)
    localhost.38311 > localhost.38311: [bad udp cksum 0xfe3b -> 0xd42b!] UDP, length 32
02:07:59.120233 IP (tos 0x0, ttl 64, id 7079, offset 0, flags [DF], proto UDP (17), length 52)
    localhost.38311 > localhost.38311: [bad udp cksum 0xfe33 -> 0x68ca!] UDP, length 24
02:07:59.121857 IP (tos 0x0, ttl 64, id 7080, offset 0, flags [DF], proto UDP (17), length 60)
    localhost.38311 > localhost.38311: [bad udp cksum 0xfe3b -> 0x2142!] UDP, length 32
02:07:59.132951 IP (tos 0x0, ttl 64, id 7081, offset 0, flags [DF], proto UDP (17), length 964)
    localhost.38311 > localhost.38311: [bad udp cksum 0x01c4 -> 0x1c96!] UDP, length 936
02:07:59.132977 IP (tos 0x0, ttl 64, id 7082, offset 0, flags [DF], proto UDP (17), length 404)
    localhost.38311 > localhost.38311: [bad udp cksum 0xff93 -> 0x387c!] UDP, length 376
02:07:59.132985 IP (tos 0x0, ttl 64, id 7083, offset 0, flags [DF], proto UDP (17), length 516)
    localhost.38311 > localhost.38311: [bad udp cksum 0x0004 -> 0x4295!] UDP, length 488
02:07:59.864144 IP (tos 0x0, ttl 64, id 40042, offset 0, flags [DF], proto TCP (6), length 60)
    localhost.46487 > magomedali-HLYL-WXX9.epmd: Flags [S], cksum 0xff30 (incorrect -> 0xe4e4), seq 244151662, win 65495, options [mss 65495,sackOK,TS val 1854189812 ecr 0,nop,wscale 7], length 0
02:07:59.864175 IP (tos 0x0, ttl 64, id 0, offset 0, flags [DF], proto TCP (6), length 60)
    magomedali-HLYL-WXX9.epmd > localhost.46487: Flags [S.], cksum 0xff30 (incorrect -> 0x5044), seq 4115726179, ack 244151663, win 65483, options [mss 65495,sackOK,TS val 2402357429 ecr 1854189812,nop,wscale 7], length 0
02:07:59.864196 IP (tos 0x0, ttl 64, id 40043, offset 0, flags [DF], proto TCP (6), length 52)
    localhost.46487 > magomedali-HLYL-WXX9.epmd: Flags [.], cksum 0xff28 (incorrect -> 0x7700), seq 1, ack 1, win 512, options [nop,nop,TS val 1854189812 ecr 2402357429], length 0
02:07:59.864370 IP (tos 0x0, ttl 64, id 40044, offset 0, flags [DF], proto TCP (6), length 61)
    localhost.46487 > magomedali-HLYL-WXX9.epmd: Flags [P.], cksum 0xff31 (incorrect -> 0xc4a9), seq 1:10, ack 1, win 512, options [nop,nop,TS val 1854189812 ecr 2402357429], length 9
02:07:59.864382 IP (tos 0x0, ttl 64, id 43772, offset 0, flags [DF], proto TCP (6), length 52)
    magomedali-HLYL-WXX9.epmd > localhost.46487: Flags [.], cksum 0xff28 (incorrect -> 0x76f7), seq 1, ack 10, win 512, options [nop,nop,TS val 2402357429 ecr 1854189812], length 0
02:07:59.864452 IP (tos 0x0, ttl 64, id 43773, offset 0, flags [DF], proto TCP (6), length 72)
    magomedali-HLYL-WXX9.epmd > localhost.46487: Flags [P.], cksum 0xff3c (incorrect -> 0x104a), seq 1:21, ack 10, win 512, options [nop,nop,TS val 2402357429 ecr 1854189812], length 20
02:07:59.864464 IP (tos 0x0, ttl 64, id 40045, offset 0, flags [DF], proto TCP (6), length 52)
    localhost.46487 > magomedali-HLYL-WXX9.epmd: Flags [.], cksum 0xff28 (incorrect -> 0x76e3), seq 10, ack 21, win 512, options [nop,nop,TS val 1854189812 ecr 2402357429], length 0
02:07:59.864484 IP (tos 0x0, ttl 64, id 43774, offset 0, flags [DF], proto TCP (6), length 52)
    magomedali-HLYL-WXX9.epmd > localhost.46487: Flags [F.], cksum 0xff28 (incorrect -> 0x76e2), seq 21, ack 10, win 512, options [nop,nop,TS val 2402357429 ecr 1854189812], length 0
02:07:59.864672 IP (tos 0x0, ttl 64, id 40046, offset 0, flags [DF], proto TCP (6), length 52)
    localhost.46487 > magomedali-HLYL-WXX9.epmd: Flags [F.], cksum 0xff28 (incorrect -> 0x76e1), seq 10, ack 22, win 512, options [nop,nop,TS val 1854189812 ecr 2402357429], length 0
02:07:59.864695 IP (tos 0x0, ttl 64, id 43775, offset 0, flags [DF], proto TCP (6), length 52)
    magomedali-HLYL-WXX9.epmd > localhost.46487: Flags [.], cksum 0xff28 (incorrect -> 0x76e1), seq 22, ack 11, win 512, options [nop,nop,TS val 2402357429 ecr 1854189812], length 0
02:08:00.016669 IP (tos 0x0, ttl 64, id 966, offset 0, flags [DF], proto TCP (6), length 60)
    localhost.59071 > localhost.epmd: Flags [S], cksum 0xfe30 (incorrect -> 0x4d1e), seq 4222037538, win 65495, options [mss 65495,sackOK,TS val 956803137 ecr 0,nop,wscale 7], length 0
02:08:00.016689 IP (tos 0x0, ttl 64, id 0, offset 0, flags [DF], proto TCP (6), length 60)
    localhost.epmd > localhost.59071: Flags [S.], cksum 0xfe30 (incorrect -> 0x1284), seq 2334445095, ack 4222037539, win 65483, options [mss 65495,sackOK,TS val 956803137 ecr 956803137,nop,wscale 7], length 0
02:08:00.016704 IP (tos 0x0, ttl 64, id 967, offset 0, flags [DF], proto TCP (6), length 52)
    localhost.59071 > localhost.epmd: Flags [.], cksum 0xfe28 (incorrect -> 0x3940), seq 1, ack 1, win 512, options [nop,nop,TS val 956803137 ecr 956803137], length 0
02:08:00.016841 IP (tos 0x0, ttl 64, id 968, offset 0, flags [DF], proto TCP (6), length 89)
    localhost.59071 > localhost.epmd: Flags [P.], cksum 0xfe4d (incorrect -> 0x45b9), seq 1:38, ack 1, win 512, options [nop,nop,TS val 956803138 ecr 956803137], length 37
02:08:00.016847 IP (tos 0x0, ttl 64, id 25284, offset 0, flags [DF], proto TCP (6), length 52)
    localhost.epmd > localhost.59071: Flags [.], cksum 0xfe28 (incorrect -> 0x3919), seq 1, ack 38, win 512, options [nop,nop,TS val 956803138 ecr 956803138], length 0
02:08:00.016889 IP (tos 0x0, ttl 64, id 25285, offset 0, flags [DF], proto TCP (6), length 56)
    localhost.epmd > localhost.59071: Flags [P.], cksum 0xfe2c (incorrect -> 0xc00b), seq 1:5, ack 38, win 512, options [nop,nop,TS val 956803138 ecr 956803138], length 4
02:08:00.016902 IP (tos 0x0, ttl 64, id 969, offset 0, flags [DF], proto TCP (6), length 52)
    localhost.59071 > localhost.epmd: Flags [.], cksum 0xfe28 (incorrect -> 0x3915), seq 38, ack 5, win 512, options [nop,nop,TS val 956803138 ecr 956803138], length 0
02:08:00.025761 IP (tos 0x0, ttl 64, id 970, offset 0, flags [DF], proto TCP (6), length 52)
    localhost.59071 > localhost.epmd: Flags [F.], cksum 0xfe28 (incorrect -> 0x390c), seq 38, ack 5, win 512, options [nop,nop,TS val 956803146 ecr 956803138], length 0
02:08:00.025861 IP (tos 0x0, ttl 64, id 25286, offset 0, flags [DF], proto TCP (6), length 52)
    localhost.epmd > localhost.59071: Flags [F.], cksum 0xfe28 (incorrect -> 0x3902), seq 5, ack 39, win 512, options [nop,nop,TS val 956803147 ecr 956803146], length 0
02:08:00.025897 IP (tos 0x0, ttl 64, id 971, offset 0, flags [DF], proto TCP (6), length 52)
    localhost.59071 > localhost.epmd: Flags [.], cksum 0xfe28 (incorrect -> 0x3901), seq 39, ack 6, win 512, options [nop,nop,TS val 956803147 ecr 956803147], length 0
02:08:00.833931 IP (tos 0x0, ttl 64, id 4886, offset 0, flags [DF], proto TCP (6), length 60)
    localhost.37188 > localhost.8005: Flags [P.], cksum 0xfe30 (incorrect -> 0x343c), seq 25:33, ack 13, win 512, options [nop,nop,TS val 956803955 ecr 956801295], length 8
02:08:00.834042 IP (tos 0x0, ttl 64, id 4113, offset 0, flags [DF], proto TCP (6), length 56)
    localhost.8005 > localhost.37188: Flags [P.], cksum 0xfe2c (incorrect -> 0xc238), seq 13:17, ack 33, win 512, options [nop,nop,TS val 956803955 ecr 956803955], length 4
02:08:00.834060 IP (tos 0x0, ttl 64, id 4887, offset 0, flags [DF], proto TCP (6), length 52)
    localhost.37188 > localhost.8005: Flags [.], cksum 0xfe28 (incorrect -> 0xa215), seq 33, ack 17, win 512, options [nop,nop,TS val 956803955 ecr 956803955], length 0
02:08:02.724846 IP (tos 0x0, ttl 64, id 4888, offset 0, flags [DF], proto TCP (6), length 60)
    localhost.37188 > localhost.8005: Flags [P.], cksum 0xfe30 (incorrect -> 0x2169), seq 33:41, ack 17, win 512, options [nop,nop,TS val 956805846 ecr 956803955], length 8
02:08:02.724942 IP (tos 0x0, ttl 64, id 4114, offset 0, flags [DF], proto TCP (6), length 56)
    localhost.8005 > localhost.37188: Flags [P.], cksum 0xfe2c (incorrect -> 0xb366), seq 17:21, ack 41, win 512, options [nop,nop,TS val 956805846 ecr 956805846], length 4
02:08:02.724957 IP (tos 0x0, ttl 64, id 4889, offset 0, flags [DF], proto TCP (6), length 52)
    localhost.37188 > localhost.8005: Flags [.], cksum 0xfe28 (incorrect -> 0x9343), seq 41, ack 21, win 512, options [nop,nop,TS val 956805846 ecr 956805846], length 0
02:08:05.529608 IP (tos 0x0, ttl 64, id 4890, offset 0, flags [DF], proto TCP (6), length 60)
    localhost.37188 > localhost.8005: Flags [P.], cksum 0xfe30 (incorrect -> 0x0f04), seq 41:49, ack 21, win 512, options [nop,nop,TS val 956808650 ecr 956805846], length 8
02:08:05.529737 IP (tos 0x0, ttl 64, id 4115, offset 0, flags [DF], proto TCP (6), length 56)
    localhost.8005 > localhost.37188: Flags [P.], cksum 0xfe2c (incorrect -> 0x9d72), seq 21:25, ack 49, win 512, options [nop,nop,TS val 956808650 ecr 956808650], length 4
02:08:05.529755 IP (tos 0x0, ttl 64, id 4891, offset 0, flags [DF], proto TCP (6), length 52)
    localhost.37188 > localhost.8005: Flags [.], cksum 0xfe28 (incorrect -> 0x7d4f), seq 49, ack 25, win 512, options [nop,nop,TS val 956808650 ecr 956808650], length 0
02:08:08.056009 IP (tos 0x0, ttl 64, id 4892, offset 0, flags [DF], proto TCP (6), length 60)
    localhost.37188 > localhost.8005: Flags [P.], cksum 0xfe30 (incorrect -> 0xfa23), seq 49:57, ack 25, win 512, options [nop,nop,TS val 956811177 ecr 956808650], length 8
02:08:08.056182 IP (tos 0x0, ttl 64, id 4116, offset 0, flags [DF], proto TCP (6), length 56)
    localhost.8005 > localhost.37188: Flags [P.], cksum 0xfe2c (incorrect -> 0x89a8), seq 25:29, ack 57, win 512, options [nop,nop,TS val 956811177 ecr 956811177], length 4
02:08:08.056202 IP (tos 0x0, ttl 64, id 4893, offset 0, flags [DF], proto TCP (6), length 52)
    localhost.37188 > localhost.8005: Flags [.], cksum 0xfe28 (incorrect -> 0x6985), seq 57, ack 29, win 512, options [nop,nop,TS val 956811177 ecr 956811177], length 0
02:08:12.302913 IP (tos 0x0, ttl 64, id 4894, offset 0, flags [DF], proto TCP (6), length 60)
    localhost.37188 > localhost.8005: Flags [P.], cksum 0xfe30 (incorrect -> 0xdfa0), seq 57:65, ack 29, win 512, options [nop,nop,TS val 956815424 ecr 956811177], length 8
02:08:12.303050 IP (tos 0x0, ttl 64, id 4117, offset 0, flags [DF], proto TCP (6), length 56)
    localhost.8005 > localhost.37188: Flags [P.], cksum 0xfe2c (incorrect -> 0x686e), seq 29:33, ack 65, win 512, options [nop,nop,TS val 956815424 ecr 956815424], length 4
02:08:12.303069 IP (tos 0x0, ttl 64, id 4895, offset 0, flags [DF], proto TCP (6), length 52)
    localhost.37188 > localhost.8005: Flags [.], cksum 0xfe28 (incorrect -> 0x484b), seq 65, ack 33, win 512, options [nop,nop,TS val 956815424 ecr 956815424], length 0
02:08:15.801053 IP (tos 0x0, ttl 64, id 4896, offset 0, flags [DF], proto TCP (6), length 60)
    localhost.37188 > localhost.8005: Flags [P.], cksum 0xfe30 (incorrect -> 0xc14f), seq 65:73, ack 33, win 512, options [nop,nop,TS val 956818922 ecr 956815424], length 8
02:08:15.801189 IP (tos 0x0, ttl 64, id 4118, offset 0, flags [DF], proto TCP (6), length 56)
    localhost.8005 > localhost.37188: Flags [P.], cksum 0xfe2c (incorrect -> 0x4d0e), seq 33:37, ack 73, win 512, options [nop,nop,TS val 956818922 ecr 956818922], length 4
02:08:15.801209 IP (tos 0x0, ttl 64, id 4897, offset 0, flags [DF], proto TCP (6), length 52)
    localhost.37188 > localhost.8005: Flags [.], cksum 0xfe28 (incorrect -> 0x2ceb), seq 73, ack 37, win 512, options [nop,nop,TS val 956818922 ecr 956818922], length 0
02:08:19.196572 IP (tos 0x0, ttl 64, id 7084, offset 0, flags [DF], proto UDP (17), length 60)
    localhost.38311 > localhost.38311: [bad udp cksum 0xfe3b -> 0x7d18!] UDP, length 32
02:08:19.208745 IP (tos 0x0, ttl 64, id 7085, offset 0, flags [DF], proto UDP (17), length 52)
    localhost.38311 > localhost.38311: [bad udp cksum 0xfe33 -> 0x4eff!] UDP, length 24
02:08:19.210237 IP (tos 0x0, ttl 64, id 7086, offset 0, flags [DF], proto UDP (17), length 60)
    localhost.38311 > localhost.38311: [bad udp cksum 0xfe3b -> 0x25f0!] UDP, length 32
02:08:19.221090 IP (tos 0x0, ttl 64, id 7087, offset 0, flags [DF], proto UDP (17), length 964)
    localhost.38311 > localhost.38311: [bad udp cksum 0x01c4 -> 0x0152!] UDP, length 936
02:08:19.221109 IP (tos 0x0, ttl 64, id 7088, offset 0, flags [DF], proto UDP (17), length 404)
    localhost.38311 > localhost.38311: [bad udp cksum 0xff93 -> 0x1239!] UDP, length 376
02:08:19.221115 IP (tos 0x0, ttl 64, id 7089, offset 0, flags [DF], proto UDP (17), length 516)
    localhost.38311 > localhost.38311: [bad udp cksum 0x0004 -> 0x2aa0!] UDP, length 488
02:08:19.857173 IP (tos 0x0, ttl 64, id 4898, offset 0, flags [DF], proto TCP (6), length 60)
    localhost.37188 > localhost.8005: Flags [P.], cksum 0xfe30 (incorrect -> 0xa3c0), seq 73:81, ack 37, win 512, options [nop,nop,TS val 956822978 ecr 956818922], length 8
02:08:19.857304 IP (tos 0x0, ttl 64, id 4119, offset 0, flags [DF], proto TCP (6), length 56)
    localhost.8005 > localhost.37188: Flags [P.], cksum 0xfe2c (incorrect -> 0x2d52), seq 37:41, ack 81, win 512, options [nop,nop,TS val 956822978 ecr 956822978], length 4
02:08:19.857326 IP (tos 0x0, ttl 64, id 4899, offset 0, flags [DF], proto TCP (6), length 52)
    localhost.37188 > localhost.8005: Flags [.], cksum 0xfe28 (incorrect -> 0x0d2f), seq 81, ack 41, win 512, options [nop,nop,TS val 956822978 ecr 956822978], length 0
02:08:23.685841 IP (tos 0x0, ttl 64, id 4900, offset 0, flags [DF], proto TCP (6), length 61)
    localhost.37188 > localhost.8005: Flags [P.], cksum 0xfe31 (incorrect -> 0x5cef), seq 81:90, ack 41, win 512, options [nop,nop,TS val 956826807 ecr 956822978], length 9
02:08:23.685962 IP (tos 0x0, ttl 64, id 4120, offset 0, flags [DF], proto TCP (6), length 57)
    localhost.8005 > localhost.37188: Flags [P.], cksum 0xfe2d (incorrect -> 0xa85b), seq 41:46, ack 90, win 512, options [nop,nop,TS val 956826807 ecr 956826807], length 5
02:08:23.685981 IP (tos 0x0, ttl 64, id 4901, offset 0, flags [DF], proto TCP (6), length 52)
    localhost.37188 > localhost.8005: Flags [.], cksum 0xfe28 (incorrect -> 0xef36), seq 90, ack 46, win 512, options [nop,nop,TS val 956826807 ecr 956826807], length 0
02:08:23.686020 IP (tos 0x0, ttl 64, id 4121, offset 0, flags [DF], proto TCP (6), length 52)
    localhost.8005 > localhost.37188: Flags [F.], cksum 0xfe28 (incorrect -> 0xef35), seq 46, ack 90, win 512, options [nop,nop,TS val 956826807 ecr 956826807], length 0
02:08:23.688322 IP (tos 0x0, ttl 64, id 4902, offset 0, flags [DF], proto TCP (6), length 52)
    localhost.37188 > localhost.8005: Flags [F.], cksum 0xfe28 (incorrect -> 0xef32), seq 90, ack 47, win 512, options [nop,nop,TS val 956826809 ecr 956826807], length 0
02:08:23.688374 IP (tos 0x0, ttl 64, id 4122, offset 0, flags [DF], proto TCP (6), length 52)
    localhost.8005 > localhost.37188: Flags [.], cksum 0xfe28 (incorrect -> 0xef30), seq 47, ack 91, win 512, options [nop,nop,TS val 956826809 ecr 956826809], length 0

